[
  {
    "core": true,
    "description_md": "Designs, builds, and manages AI infrastructure for cost-effectiveness, performance, and reliability.\n\nMore details\n\nWho this is\n\nPlatform and infrastructure engineering, ML platform and MLOps, inference and model-serving teams, SRE, data and RAG-pipeline teams. In most organizations, several teams rather than one role.\n\nSub-area · ML / Data Pipeline\n\nRAG pipelines, retrieval systems, data preprocessing, and evaluation infrastructure sit under Engineering’s platform-layer ownership. Many organizations treat them as a distinct function worth naming and budgeting separately.\n\nWhat this persona owns\n\n- Owns the platform layer and the Total Cost of AI (TCA): orchestration, routing, gateways, observability. Platform-layer spend can exceed raw token cost; tokens are 8–27% of total agent run costs [9].\n- GPU utilization and model serving: KV cache grows with context length and concurrent users until, on long-context workloads, it can cost more than serving the model itself.\n- Model lifecycle: frontier models replaced within months; infrastructure commitments outlive model shelf life.\n- Effective cost is a systems property. IBM Research: Claude Sonnet 4.6 cost roughly half of GPT-4.1 across 417 tasks despite higher list prices, because cache-read pricing interacted with context reuse [10]. Engineering owns the serving conditions that produce results like this.\n\nKey decisions\n\nModel serving targets, platform trade-offs (throughput vs. context window), concurrency limits, gateway and observability architecture, and routing policy. The constraint is capturing routing savings without breaking the prefix caching that makes those savings real.",
    "name": "Engineering",
    "provenance": {
      "document": "personas-operating-model",
      "license": "CC-BY-4.0",
      "section": "wp-personas",
      "source_url": "https://www.tokeneconomics.com/projects/personas-and-operating-model-map/"
    },
    "responsibility": "Platform-layer costs, model lifecycle, RAG pipelines",
    "signals": [
      "Tokens per second",
      "GPU hours per million tokens",
      "Cache hit rate",
      "Platform-layer overhead as % of AI spend",
      "Request-to-call ratio"
    ],
    "slug": "engineering",
    "stages": [
      "production",
      "consumption"
    ]
  },
  {
    "core": true,
    "description_md": "Bridges business, engineering, and finance; enables evidence-based decisions on AI spend through cost and usage visibility and attribution.\n\nMore details\n\n- Pricing is non-linear: tokenizers, caching, context windows, and routing move effective price by large multiples. Model choice alone swings cost 9.1x for identical workloads [9].\n- Anomaly detection shifts from spend spikes to complexity shifts: agent loops, runaway sessions, prompt injection attacks.\n- Visibility into opaque spend: SaaS vendors bundling AI costs, multi-provider routing, credit-based pricing. FOCUS 1.2 added virtual-currency columns for this [11], and 1.5 goes considerably further: model developer, family, ID, and version are merged into the working draft, so AI spend can be broken out by model without vendor-specific parsing, and a principal identifier is in flight to attribute a charge to a person, team, or automated agent [12]. One thing 1.5 does not settle: separating cache-served tokens from freshly processed ones is still under consideration rather than committed, so the cache hit rate that drives much of the cost may not appear in billing data this release.\n- Change management: the questions the rest of the organization needs asked about why AI does not behave like traditional cloud compute. Forecast variance is expected when consumption moves this fast; the answer is agility, re-forecasting frequently as usage patterns shift, not a more accurate single forecast.\n\nKey decisions\n\nBudget thresholds for non-linear pricing, governance for agent depth and session budgets, cost attribution including model family and tier, FOCUS adoption path for AI spend.",
    "name": "FinOps Practitioner",
    "provenance": {
      "document": "personas-operating-model",
      "license": "CC-BY-4.0",
      "section": "wp-personas",
      "source_url": "https://www.tokeneconomics.com/projects/personas-and-operating-model-map/"
    },
    "responsibility": "Track and allocate AI cost and usage",
    "signals": [
      "% of AI spend attributed",
      "Anomaly detection coverage",
      "Budget utilization by value category",
      "Share of spend on FOCUS-conformant data"
    ],
    "slug": "finops-practitioner",
    "stages": [
      "consumption"
    ]
  },
  {
    "core": true,
    "description_md": "Generates the demand every other persona on this map plans, governs, and measures. Every AI service terminates in an end user’s workflow, and the business value is realized there or not at all.\n\nMore details\n\nWho this is\n\nThe broadest umbrella on the map, and deliberately not a job title. In many organizations it is the entire workforce: developers on coding assistants, support agents on summarization tools, marketers on drafting copilots, analysts on research and retrieval tools, product teams on evaluation workflows. The unit is the work, not the role: anyone whose workflow consumes AI services is an AI end user, developer or not.\n\nThe subtypes are **consumption surfaces, not departments**. The same person moves between surfaces in a day:\n\n- **Interactive prompt:** a human in the loop on every turn: drafting, Q&A, review. Spend scales with seats and habits.\n- **Agentic:** the user initiates a task and the agent runs, sometimes in parallel sub-agents, sometimes for extended periods. Spend scales with task depth rather than headcount, and the failure mode is a loop or a runaway session, not a bad prompt.\n- **Embedded:** AI baked into tools the user already uses: autocomplete, drafts, search. Invisible to the user, and through bundled SaaS pricing often to the organization as well.\n\nTwo further axes split the same user: who provisions the surface (a platform or IT-managed seat, a department-managed tool, a personal subscription the organization never saw), and whether the AI is Internal (augmenting the user’s own work) or Product (embedded in what the user delivers to customers). The tools, the providers, and the spend profiles differ across all three axes.\n\nWhat this persona owns\n\n- Demand: adoption, usage patterns, and the interactive vs. agentic mix are the demand signal that every forecast, reservation, and capacity plan on this map runs against.\n- Quality floors in use: the floor Product or Engineering sets is only as real as whether the user’s actual task clears it. Re-prompts, corrections, discarded outputs, and workarounds are the cheapest quality data in the stack, and they sit with the user.\n- Off-platform spend: personal keys, personal subscriptions, consumer tools pointed at work data. The spend that FOCUS-conformant data never sees, and where a material share of the data risk sits.\n- Value realization: intelligence becomes business value at the point of use, so usage is the first value signal you get. When a tool sits unused, the value case, the quality floor, or the tool itself is wrong somewhere.\n\nKey decisions\n\nWhich tool and model tier to use within what is provisioned; when a task is worth the agentic offload; what to escalate to a human, to Product, or to Security; reporting loops, quality degradation, and off-platform use.",
    "name": "AI End User",
    "provenance": {
      "document": "personas-operating-model",
      "license": "CC-BY-4.0",
      "section": "wp-personas",
      "source_url": "https://www.tokeneconomics.com/projects/personas-and-operating-model-map/"
    },
    "responsibility": "Generates the demand; the surfaces where services are consumed and value is realized or not",
    "signals": [
      "Adoption and retention by tool",
      "Interactive vs. agentic share of usage",
      "Re-prompt and correction rate",
      "Outputs used as-is vs. discarded",
      "Off-platform spend by team",
      "Cost per user by surface"
    ],
    "slug": "ai-end-user",
    "stages": [
      "consumption",
      "value"
    ]
  },
  {
    "core": true,